<?xml version="1.0" encoding="UTF-8"?>
<pattern xmlns:xsi="http://www.w3.org/2001/XMLSchema-instance" xsi:schemaLocation="pattern_description.xsd">
	<name>Cache</name>
	<interfaceModel>Quality</interfaceModel>
	<mismatches>
		<attribute>
			<name>Performance</name>
			<suitability>+</suitability>
		</attribute>
		<attribute>
			<name>Reliability</name>
			<suitability>-</suitability>
		</attribute>
	</mismatches>
	<description>A cache okjnsd  asjdfkl psadf kosal ösfjpkasö öljsaf asoiu snf soi lsdmp sdsup öakj ds hsf ödnso ysafm.</description>
	<source>Kircher/Jain: Pattern Oriented Software Architecture</source>
	<adaptorTemplates>
		<template>CacheAdaptor.cst</template>
		<template>CacheAdaptorUnitTests.cst</template>
	</adaptorTemplates>
	<predictionModels>
		<predictionModel name="Palladio">
			<usageInstructions>Execute with Palladio_Performance_Prediction_xml</usageInstructions>
			<template>SEA_CacheAdaptor.cst</template>
		</predictionModel>
	</predictionModels>
</pattern>
